<?xml version="1.0" encoding="UTF-8"?>
<eventMetadata  xmlns:tns="http://www.ibm.com/teal/eventmeta" 
                xmlns:xsi="http://www.w3.org/2001/XMLSchema-instance" 
				xsi:schemaLocation="http://www.ibm.com/teal/eventmeta ../../../../../xml/eventmeta.xsd ">
	<event id="LL001000" comp="LL">
		<message>Schedd daemon down</message>
	</event>
	<event id="LL001001" comp="LL">
		<message>Startd daemon down</message>
	</event>
	<event id="LL001003" comp="LL">
		<message>Central Manager down</message>
	</event>
	<event id="LL001004" comp="LL">
		<message>Resource Manager down</message>
	</event>
	<event id="LL001005" comp="LL">
		<message>Region Manager down</message>
	</event>
	<event id="LL002001" comp="LL">
		<message>Job step rejected</message>
	</event>
	<event id="LL002002" comp="LL">
		<message>Job step vacated</message>
	</event>
</eventMetadata>